{
  "input_provenance_sha256": "8681e0f63499179310599cf3c501fdd487536db63d1a3f71a0c7365104361864",
  "kind": "infrawright.source_evidence_report",
  "resources": {
    "zpa_app_connector_group": {
      "chains": [
        {
          "endpoint": null,
          "reason_code": "endpoint_not_recovered",
          "sdk_call": {
            "location": {
              "column": 6,
              "function": "GetAll",
              "line": 165,
              "origin": "sdk",
              "path": "zscaler/zpa/services/appconnectorgroup/zpa_app_connector_group.go",
              "sdk_module_path": "github.com/zscaler/zscaler-sdk-go/v3"
            },
            "module_path": "github.com/zscaler/zscaler-sdk-go/v3",
            "module_version": "v3.8.42",
            "package_path": "github.com/zscaler/zscaler-sdk-go/v3/zscaler/zpa/services/appconnectorgroup",
            "symbol": "GetAll"
          },
          "steps": [
            {
              "callee": {
                "location": {
                  "column": 6,
                  "function": "GetAll",
                  "line": 165,
                  "origin": "sdk",
                  "path": "zscaler/zpa/services/appconnectorgroup/zpa_app_connector_group.go",
                  "sdk_module_path": "github.com/zscaler/zscaler-sdk-go/v3"
                },
                "package_path": "github.com/zscaler/zscaler-sdk-go/v3/zscaler/zpa/services/appconnectorgroup",
                "symbol": "GetAll"
              },
              "caller": {
                "location": {
                  "column": 6,
                  "function": "resourceAppConnectorGroupRead",
                  "line": 269,
                  "origin": "provider",
                  "path": "zpa/resource_zpa_app_connector_group.go",
                  "sdk_module_path": null
                },
                "package_path": "github.com/zscaler/terraform-provider-zpa/v4/zpa",
                "symbol": "resourceAppConnectorGroupRead"
              },
              "import_path": "github.com/zscaler/zscaler-sdk-go/v3/zscaler/zpa/services/appconnectorgroup",
              "kind": "sdk_package_function",
              "location": {
                "column": 36,
                "function": "resourceAppConnectorGroupRead",
                "line": 280,
                "origin": "provider",
                "path": "zpa/resource_zpa_app_connector_group.go",
                "sdk_module_path": null
              },
              "symbol": "appconnectorgroup.GetAll"
            }
          ]
        }
      ],
      "classification": "observed_sdk_call",
      "legacy_mapped": false,
      "provider_registration": {
        "location": {
          "column": 52,
          "function": null,
          "line": 148,
          "origin": "provider",
          "path": "zpa/provider.go",
          "sdk_module_path": null
        },
        "package_path": "github.com/zscaler/terraform-provider-zpa/v4/zpa",
        "symbol": "resourceAppConnectorGroup"
      },
      "read_callback": {
        "location": {
          "column": 6,
          "function": "resourceAppConnectorGroupRead",
          "line": 269,
          "origin": "provider",
          "path": "zpa/resource_zpa_app_connector_group.go",
          "sdk_module_path": null
        },
        "package_path": "github.com/zscaler/terraform-provider-zpa/v4/zpa",
        "symbol": "resourceAppConnectorGroupRead"
      },
      "reason_code": null
    },
    "zpa_application_segment": {
      "chains": [
        {
          "endpoint": null,
          "reason_code": "endpoint_not_recovered",
          "sdk_call": {
            "location": {
              "column": 6,
              "function": "Get",
              "line": 151,
              "origin": "sdk",
              "path": "zscaler/zpa/services/applicationsegment/zpa_application_segment.go",
              "sdk_module_path": "github.com/zscaler/zscaler-sdk-go/v3"
            },
            "module_path": "github.com/zscaler/zscaler-sdk-go/v3",
            "module_version": "v3.8.42",
            "package_path": "github.com/zscaler/zscaler-sdk-go/v3/zscaler/zpa/services/applicationsegment",
            "symbol": "Get"
          },
          "steps": [
            {
              "callee": {
                "location": {
                  "column": 6,
                  "function": "Get",
                  "line": 151,
                  "origin": "sdk",
                  "path": "zscaler/zpa/services/applicationsegment/zpa_application_segment.go",
                  "sdk_module_path": "github.com/zscaler/zscaler-sdk-go/v3"
                },
                "package_path": "github.com/zscaler/zscaler-sdk-go/v3/zscaler/zpa/services/applicationsegment",
                "symbol": "Get"
              },
              "caller": {
                "location": {
                  "column": 6,
                  "function": "resourceApplicationSegmentRead",
                  "line": 326,
                  "origin": "provider",
                  "path": "zpa/resource_zpa_application_segment.go",
                  "sdk_module_path": null
                },
                "package_path": "github.com/zscaler/terraform-provider-zpa/v4/zpa",
                "symbol": "resourceApplicationSegmentRead"
              },
              "import_path": "github.com/zscaler/zscaler-sdk-go/v3/zscaler/zpa/services/applicationsegment",
              "kind": "sdk_package_function",
              "location": {
                "column": 37,
                "function": "resourceApplicationSegmentRead",
                "line": 335,
                "origin": "provider",
                "path": "zpa/resource_zpa_application_segment.go",
                "sdk_module_path": null
              },
              "symbol": "applicationsegment.Get"
            },
            {
              "callee": {
                "location": {
                  "column": 23,
                  "function": "(*Client).NewRequestDo",
                  "line": 16,
                  "origin": "sdk",
                  "path": "zscaler/zparequests.go",
                  "sdk_module_path": "github.com/zscaler/zscaler-sdk-go/v3"
                },
                "package_path": "github.com/zscaler/zscaler-sdk-go/v3/zscaler",
                "symbol": "(*Client).NewRequestDo"
              },
              "caller": {
                "location": {
                  "column": 6,
                  "function": "Get",
                  "line": 151,
                  "origin": "sdk",
                  "path": "zscaler/zpa/services/applicationsegment/zpa_application_segment.go",
                  "sdk_module_path": "github.com/zscaler/zscaler-sdk-go/v3"
                },
                "package_path": "github.com/zscaler/zscaler-sdk-go/v3/zscaler/zpa/services/applicationsegment",
                "symbol": "Get"
              },
              "import_path": "github.com/zscaler/zscaler-sdk-go/v3/zscaler",
              "kind": "sdk_receiver_method",
              "location": {
                "column": 30,
                "function": "Get",
                "line": 154,
                "origin": "sdk",
                "path": "zscaler/zpa/services/applicationsegment/zpa_application_segment.go",
                "sdk_module_path": "github.com/zscaler/zscaler-sdk-go/v3"
              },
              "symbol": "(*zscaler.Client).NewRequestDo"
            }
          ]
        }
      ],
      "classification": "observed_sdk_call",
      "legacy_mapped": false,
      "provider_registration": {
        "location": {
          "column": 52,
          "function": null,
          "line": 150,
          "origin": "provider",
          "path": "zpa/provider.go",
          "sdk_module_path": null
        },
        "package_path": "github.com/zscaler/terraform-provider-zpa/v4/zpa",
        "symbol": "resourceApplicationSegment"
      },
      "read_callback": {
        "location": {
          "column": 6,
          "function": "resourceApplicationSegmentRead",
          "line": 326,
          "origin": "provider",
          "path": "zpa/resource_zpa_application_segment.go",
          "sdk_module_path": null
        },
        "package_path": "github.com/zscaler/terraform-provider-zpa/v4/zpa",
        "symbol": "resourceApplicationSegmentRead"
      },
      "reason_code": null
    },
    "zpa_application_server": {
      "chains": [
        {
          "endpoint": null,
          "reason_code": "endpoint_not_recovered",
          "sdk_call": {
            "location": {
              "column": 6,
              "function": "Get",
              "line": 33,
              "origin": "sdk",
              "path": "zscaler/zpa/services/appservercontroller/zpa_app_server_controller.go",
              "sdk_module_path": "github.com/zscaler/zscaler-sdk-go/v3"
            },
            "module_path": "github.com/zscaler/zscaler-sdk-go/v3",
            "module_version": "v3.8.42",
            "package_path": "github.com/zscaler/zscaler-sdk-go/v3/zscaler/zpa/services/appservercontroller",
            "symbol": "Get"
          },
          "steps": [
            {
              "callee": {
                "location": {
                  "column": 6,
                  "function": "Get",
                  "line": 33,
                  "origin": "sdk",
                  "path": "zscaler/zpa/services/appservercontroller/zpa_app_server_controller.go",
                  "sdk_module_path": "github.com/zscaler/zscaler-sdk-go/v3"
                },
                "package_path": "github.com/zscaler/zscaler-sdk-go/v3/zscaler/zpa/services/appservercontroller",
                "symbol": "Get"
              },
              "caller": {
                "location": {
                  "column": 6,
                  "function": "resourceApplicationServerRead",
                  "line": 126,
                  "origin": "provider",
                  "path": "zpa/resource_zpa_app_server_controller.go",